{"authority":"RESEARCH_DERIVED_NON_AUTHORITATIVE","canonical_binding_resolved":false,"derivation_contract_hash":"bbb2e4f29ac88da42102ee6c08d239f8e0a72760ab8d1371fdea2cda258ed47d","field_id":"eco-evo3/e3.2/field/9be81517eaf0c28503291c55","field_provenance_hash":"9be81517eaf0c28503291c5595c0790232b8f88c7ffa9ced2e886ec1f8597aa4","opportunity_field_hash":"acba61638f8128b667880f2bd391ab73f6175d0899656bba92657d578d48203c","opportunity_field_hash_algorithm":"SHA256_CANONICAL_JSON_SORTED_KEYS_V1","reference_frame_identity":"frame-fixture/planet-alpha/body-fixed-r1","samples":[{"establishment_opportunity_ppm":110400,"latitude_microdeg":-75000000,"light_opportunity_ppm":320000,"limiting_resource_opportunity_ppm":120000,"longitude_microdeg":-150000000,"nutrient_opportunity_ppm":180000,"opportunity_id":"eco-evo3/e3.2/opportunity/78256b2ab7536b19c7ecdb2b","opportunity_sample_hash":"10ec58ddc790a13e6a9dd961f8255245822d5138417784a99008ebebcd9f08ec","persistence_opportunity_ppm":920000,"source_field_provenance_hash":"c3d9d5792a0fcb92804dda1b9c9185918517cca2f951c7623611c6f0ffc037a1","source_sample_hash":"e7b6bfb117e3d68bcac3539952b4a735f6a13459262024088b58dc59ac8a81a6","stable_spatial_key":"eco-evo3-fixture/planet-alpha/cell-01","thermal_context_milli_c":-18000,"water_opportunity_ppm":120000},{"establishment_opportunity_ppm":158400,"latitude_microdeg":-60000000,"light_opportunity_ppm":390000,"limiting_resource_opportunity_ppm":180000,"longitude_microdeg":-120000000,"nutrient_opportunity_ppm":240000,"opportunity_id":"eco-evo3/e3.2/opportunity/b2f31c47e3e2fd4ede2ee781","opportunity_sample_hash":"b414482fa468da371f3f60459cf5b0bfa0ee868f21680f344e1f95fc863a7d7c","persistence_opportunity_ppm":880000,"source_field_provenance_hash":"8e92569bfe153c2b1ed0e88feaddbc7f6863d2a64025c2d0cd8e0c960b30fcda","source_sample_hash":"dfe7d5eb7c13aae3c9e4b856281a20f9f93b3cdf1daebeac7d4ffccaaaa9454b","stable_spatial_key":"eco-evo3-fixture/planet-alpha/cell-02","thermal_context_milli_c":-12000,"water_opportunity_ppm":180000},{"establishment_opportunity_ppm":212500,"latitude_microdeg":-45000000,"light_opportunity_ppm":470000,"limiting_resource_opportunity_ppm":250000,"longitude_microdeg":-90000000,"nutrient_opportunity_ppm":310000,"opportunity_id":"eco-evo3/e3.2/opportunity/c4c6503f1f62bda159faaf14","opportunity_sample_hash":"98f65b01c15db3cb8bc3d3fc3240272007833f8ff3632fed50628f5b47c94424","persistence_opportunity_ppm":850000,"source_field_provenance_hash":"5c6fb42d8c3a1636d2e026fd7c20f2b101b1657d299df7beaf20ede82f3278d1","source_sample_hash":"70dd67175fde40d956fd1e55c6f7728c7dc8a0f4af4fca8c60d4c7cd4eed8b8a","stable_spatial_key":"eco-evo3-fixture/planet-alpha/cell-03","thermal_context_milli_c":-6000,"water_opportunity_ppm":250000},{"establishment_opportunity_ppm":265200,"latitude_microdeg":-30000000,"light_opportunity_ppm":560000,"limiting_resource_opportunity_ppm":340000,"longitude_microdeg":-60000000,"nutrient_opportunity_ppm":390000,"opportunity_id":"eco-evo3/e3.2/opportunity/890c688b645dd63cddf01ec6","opportunity_sample_hash":"ca642c51582e8426db5c91c40ffd8be3d7bb8b30d102f0a29aa058d34c9a5cc5","persistence_opportunity_ppm":780000,"source_field_provenance_hash":"78d2754d913aa85bd95209ebc1434d5d35620735b8d4bd5bcdb0252e0e7137f6","source_sample_hash":"2c9d87e88134170ea1fbdec7777de0e2aa51b3a944ef2ad317e8267413f2b2aa","stable_spatial_key":"eco-evo3-fixture/planet-alpha/cell-04","thermal_context_milli_c":2000,"water_opportunity_ppm":340000},{"establishment_opportunity_ppm":302400,"latitude_microdeg":-15000000,"light_opportunity_ppm":660000,"limiting_resource_opportunity_ppm":420000,"longitude_microdeg":-30000000,"nutrient_opportunity_ppm":470000,"opportunity_id":"eco-evo3/e3.2/opportunity/cec930e13a1f880e8dd32e40","opportunity_sample_hash":"b8bb84b21eef89cf04bbd7ffd2364c8a3615bad15b97949dfb0b546aae0ae9bb","persistence_opportunity_ppm":720000,"source_field_provenance_hash":"42503aff90bbb2b84b5c9acc0ed7fd1813a6a354513a7722914f518b9cb59916","source_sample_hash":"0d3c3ffce00e214904d9a0873ba4c896e3ec567a910f540a063843aa8abaf2be","stable_spatial_key":"eco-evo3-fixture/planet-alpha/cell-05","thermal_context_milli_c":10000,"water_opportunity_ppm":420000},{"establishment_opportunity_ppm":352000,"latitude_microdeg":0,"light_opportunity_ppm":780000,"limiting_resource_opportunity_ppm":550000,"longitude_microdeg":0,"nutrient_opportunity_ppm":550000,"opportunity_id":"eco-evo3/e3.2/opportunity/1f6799854bdda980f7ce7c99","opportunity_sample_hash":"2e5acbacfc80b789df5b6cd3cf5e3b657eef50683486050f4fa491e8577629f9","persistence_opportunity_ppm":640000,"source_field_provenance_hash":"4729b2040da00b659ec7e17b3e21c4b9b658ebc50034d4308862eed5cfb54144","source_sample_hash":"0010068c7fb8131e4fcce28b0dba20711170b5c676b8decb9d09897c6c4d0643","stable_spatial_key":"eco-evo3-fixture/planet-alpha/cell-06","thermal_context_milli_c":18000,"water_opportunity_ppm":550000},{"establishment_opportunity_ppm":359600,"latitude_microdeg":15000000,"light_opportunity_ppm":860000,"limiting_resource_opportunity_ppm":620000,"longitude_microdeg":30000000,"nutrient_opportunity_ppm":620000,"opportunity_id":"eco-evo3/e3.2/opportunity/7d08e0683d7bb93dbab00f22","opportunity_sample_hash":"de6bd2bc7d73c970115c1631378adfdb89ccdcfb0529ba026fcb6a8fc57ae164","persistence_opportunity_ppm":580000,"source_field_provenance_hash":"10ea987c0dcc5649b21740cc4995ce58f5f112181c7b4b820d67827159a2de65","source_sample_hash":"bdca01ad1c9a4779f09e7efe733c6394e69e3a22a3fcbde3d26b4f5557d140b4","stable_spatial_key":"eco-evo3-fixture/planet-alpha/cell-07","thermal_context_milli_c":25000,"water_opportunity_ppm":680000},{"establishment_opportunity_ppm":350000,"latitude_microdeg":30000000,"light_opportunity_ppm":720000,"limiting_resource_opportunity_ppm":700000,"longitude_microdeg":60000000,"nutrient_opportunity_ppm":700000,"opportunity_id":"eco-evo3/e3.2/opportunity/f698c3255f26a08091044270","opportunity_sample_hash":"2bec6c9eaa536b957bc1dd8b1dd78811f2fba61af51c62985da72b53374eec45","persistence_opportunity_ppm":500000,"source_field_provenance_hash":"0d95f2a8163790998f31f04d1ed7e1e3adc1236b9020cc82d5ae1e55c3b2969c","source_sample_hash":"3fe2a43f2ee1521be15d9f495cbdf59df6e6006a363d26a79d40b1469c93e3ea","stable_spatial_key":"eco-evo3-fixture/planet-alpha/cell-08","thermal_context_milli_c":15000,"water_opportunity_ppm":760000},{"establishment_opportunity_ppm":402600,"latitude_microdeg":45000000,"light_opportunity_ppm":610000,"limiting_resource_opportunity_ppm":610000,"longitude_microdeg":90000000,"nutrient_opportunity_ppm":640000,"opportunity_id":"eco-evo3/e3.2/opportunity/ab3ecffd986a331509c2ac65","opportunity_sample_hash":"b97ebe0fd4291f431d0661b6e2225a51739eaca3a671f1a747de0aed972a5bbb","persistence_opportunity_ppm":660000,"source_field_provenance_hash":"7ef8898fa005fd3b83a2ffc205f12ec36a94212051967ddd81c840c6fcb68ce3","source_sample_hash":"faaca89b31e9c6e5ff212755db84eec5688bfb41f02274646db9da2de3aa2e0f","stable_spatial_key":"eco-evo3-fixture/planet-alpha/cell-09","thermal_context_milli_c":7000,"water_opportunity_ppm":620000},{"establishment_opportunity_ppm":333000,"latitude_microdeg":60000000,"light_opportunity_ppm":500000,"limiting_resource_opportunity_ppm":450000,"longitude_microdeg":120000000,"nutrient_opportunity_ppm":510000,"opportunity_id":"eco-evo3/e3.2/opportunity/bc56ec3ace18a10b8046faf2","opportunity_sample_hash":"7446950b02c4ed188145688e1e7f89a480fa71f87d58ec3d193f8bb3e36480be","persistence_opportunity_ppm":740000,"source_field_provenance_hash":"678a2c70d1e3684551a4a69db3e98e620347d9803dfe872dc7762fd6fa546b2b","source_sample_hash":"462cb60b5287941e4b06ac3211047f617784385cf79d6a730e3a5bcbe399c06e","stable_spatial_key":"eco-evo3-fixture/planet-alpha/cell-10","thermal_context_milli_c":-2000,"water_opportunity_ppm":450000},{"establishment_opportunity_ppm":246000,"latitude_microdeg":75000000,"light_opportunity_ppm":400000,"limiting_resource_opportunity_ppm":300000,"longitude_microdeg":150000000,"nutrient_opportunity_ppm":360000,"opportunity_id":"eco-evo3/e3.2/opportunity/cc9fd6f125a89de020a55aed","opportunity_sample_hash":"fbaab0ca04325066ac222fe457aecfbfb47f0ec2884c80ce896c9c7ab0b2e19c","persistence_opportunity_ppm":820000,"source_field_provenance_hash":"4c8ec3673fff8170aee1b9e1164b12a2112cb1f3b8e59ef078ff467066a95b85","source_sample_hash":"fb46f044ebe4619312413c619fd613ba20cc258b9da2c24f1591439c9c927dcd","stable_spatial_key":"eco-evo3-fixture/planet-alpha/cell-11","thermal_context_milli_c":-10000,"water_opportunity_ppm":300000},{"establishment_opportunity_ppm":52500,"latitude_microdeg":5000000,"light_opportunity_ppm":900000,"limiting_resource_opportunity_ppm":150000,"longitude_microdeg":-170000000,"nutrient_opportunity_ppm":220000,"opportunity_id":"eco-evo3/e3.2/opportunity/ef9ae03eb0ddaca5ce239841","opportunity_sample_hash":"51809c6affa1a1fce56fd836067da5c9bbeeb36ef3a3bf64f6ae1cceda9fbcec","persistence_opportunity_ppm":350000,"source_field_provenance_hash":"a2d328e9ccb7cb12689b36377886faac37846e9f116b3e0bf78f18c6a17bf0a7","source_sample_hash":"4e4ce842adb797738c92e8393912e0d996069e9b4dc1e72aca52502c50cbd8f3","stable_spatial_key":"eco-evo3-fixture/planet-alpha/cell-12","thermal_context_milli_c":30000,"water_opportunity_ppm":150000}],"schema":"distributed_world_simulator.ecology.evo3_ecological_opportunity_field.v1","source_field_provenance_hash":"3827c1da7d94227fb04b5fbfbd93fd5262c826cd86503af9f540a120431a82c3","source_snapshot_hash":"2ceb042d905b06ae76acc699b60ed6c115d3e0ac7943ce7cbe0c94f962447b00","stable_planet_identity":"eco-evo3-fixture/planet-alpha-01","stable_time_key":"tf-fixture/planet-alpha/t000180","summary":{"establishment_max_ppm":402600,"establishment_mean_ppm":262050,"establishment_min_ppm":52500,"limiting_resource_max_ppm":700000,"limiting_resource_mean_ppm":390833,"limiting_resource_min_ppm":120000,"sample_count":12},"version":"1.0.0"}
